{
  "name": "Lumika Demo Toyota Dealer Agent",
  "description": "AAP-compliant Auto Agent Protocol dealer agent for Demo Auto Group in the Bay Area. Exposes inventory search, vehicle detail, dealer profile, and a unified consented lead-submission skill to buyer agents (LLMs and CRMs) over A2A.",
  "version": "0.2.0",
  "provider": {
    "organization": "Lumika AI",
    "url": "https://lumika.ai"
  },
  "documentation_url": "https://autoagentprotocol.org/docs/v0.2/intro",
  "supported_interfaces": [
    {
      "url": "https://demo-toyota.agents.lumika.ai/a2a",
      "protocol_binding": "JSONRPC",
      "protocol_version": "1.0"
    },
    {
      "url": "https://demo-toyota.agents.lumika.ai/a2a-rest",
      "protocol_binding": "HTTP+JSON",
      "protocol_version": "1.0"
    }
  ],
  "capabilities": {
    "streaming": false,
    "push_notifications": true,
    "extended_agent_card": false,
    "extensions": [
      {
        "uri": "https://autoagentprotocol.org/extensions/a2a-automotive-retail/v0.2",
        "description": "Auto Agent Protocol A2A Automotive Retail Profile v0.2",
        "required": true
      }
    ]
  },
  "default_input_modes": [
    "text/plain",
    "application/json",
    "application/vnd.autoagent+json"
  ],
  "default_output_modes": [
    "text/plain",
    "application/json",
    "application/vnd.autoagent+json"
  ],
  "skills": [
    {
      "id": "dealer.information",
      "name": "Dealer Information",
      "description": "Return Demo Auto Group's dealership profile: group name, welcome message, and one or more rooftops with address, geo, contacts, business hours, timezone, and service capabilities.",
      "tags": ["dealer", "profile", "hours", "contact"],
      "examples": [
        "What time does the San Francisco rooftop open on Saturday?",
        "Show me Demo Auto Group's locations, addresses, and phone numbers."
      ],
      "input_modes": [
        "application/vnd.autoagent.dealer-information-request+json",
        "text/plain"
      ],
      "output_modes": [
        "application/vnd.autoagent.dealer-information-response+json",
        "text/plain"
      ]
    },
    {
      "id": "inventory.facets",
      "name": "Inventory Facets",
      "description": "Return aggregated facets (makes, models, years, conditions, body styles, price/mileage ranges, statuses) over the dealer's inventory. Useful for narrowing down a search before calling inventory.search.",
      "tags": ["inventory", "facets", "search", "aggregation"],
      "examples": [
        "How many used vehicles do you have by make?",
        "What price and mileage ranges cover your certified pre-owned SUVs?"
      ],
      "input_modes": [
        "application/vnd.autoagent.inventory-facets-request+json",
        "text/plain"
      ],
      "output_modes": [
        "application/vnd.autoagent.inventory-facets-response+json",
        "text/plain"
      ]
    },
    {
      "id": "inventory.search",
      "name": "Inventory Search",
      "description": "Search the dealer's vehicle inventory by make, model, trim, year, condition, price, mileage, body style, fuel, drivetrain, VIN, stock number, or free-text query. Supports pagination and sort.",
      "tags": ["inventory", "search", "vehicles", "vin"],
      "examples": [
        "Find used Honda CR-Vs under $35,000 from 2023 or newer.",
        "Show certified pre-owned RAV4 Hybrids with under 30,000 miles."
      ],
      "input_modes": [
        "application/vnd.autoagent.inventory-search-request+json",
        "text/plain"
      ],
      "output_modes": [
        "application/vnd.autoagent.inventory-search-response+json",
        "text/plain"
      ]
    },
    {
      "id": "inventory.vehicle",
      "name": "Vehicle Detail",
      "description": "Return full detail for a specific vehicle by VIN, stock number, or vehicle_id, including FTC-compliant pricing fields (msrp, list_price, offered_price, price), photos, features, fuel economy, status, and dealer page URL.",
      "tags": ["inventory", "vehicle", "detail", "vin", "pricing"],
      "examples": [
        "Get full detail for VIN 1HGCY2F57RA000001.",
        "What's included on stock #DT-2451 with delivery to ZIP 94107?"
      ],
      "input_modes": [
        "application/vnd.autoagent.vehicle-detail-request+json",
        "text/plain"
      ],
      "output_modes": [
        "application/vnd.autoagent.vehicle-detail-response+json",
        "text/plain"
      ]
    },
    {
      "id": "lead.submit",
      "name": "Submit Lead",
      "description": "Submit a consented lead carrying customer info plus any combination of vehicle of interest, trade-in, and appointment request — a single unified contract that matches how dealerships actually take leads.",
      "tags": ["lead", "submit", "vehicle", "trade-in", "appointment", "consent", "adf"],
      "examples": [
        "Send a buy lead for VIN 1HGCY2F57RA000001 with a 2020 Passat trade-in and a Sunday test drive.",
        "Submit a financing question on behalf of the user (no vehicle).",
        "Book a test drive for VIN 1HGCY2F57RA000001 next Saturday morning."
      ],
      "input_modes": [
        "application/vnd.autoagent.lead-submit-request+json",
        "text/plain"
      ],
      "output_modes": [
        "application/vnd.autoagent.lead-submit-response+json",
        "text/plain"
      ]
    }
  ],
  "security_schemes": {
    "bearer": {
      "http_security_scheme": {
        "scheme": "bearer",
        "bearer_format": "JWT",
        "description": "Bearer JWT issued by Lumika AI for authorized buyer agents. Tokens MUST be sent in the 'Authorization: Bearer <token>' header on every request."
      }
    }
  },
  "security_requirements": [
    { "bearer": [] }
  ]
}
